title,summary,url,source,collected_at,category,text,processed_text,label
Atlético-MG x Cienciano: onde assistir ao vivo e horário do jogo pela Sul-Americana,,https://exame.com/esporte/atletico-mg-x-cienciano-onde-assistir-ao-vivo-e-horario-do-jogo-pela-sul-americana/,exame,2025-05-31 19:11:09,resultado,Atlético-MG x Cienciano: onde assistir ao vivo e horário do jogo pela Sul-Americana ,atletico mg x cienciano assistir vivo horario jogo sul americano,0
Fluminense x Once Caldas: onde assistir ao vivo e horário do jogo pela Sul-Americana,,https://exame.com/esporte/fluminense-x-once-caldas-onde-assistir-ao-vivo-e-horario-do-jogo-pela-sul-americana/,exame,2025-05-31 19:11:09,resultado,Fluminense x Once Caldas: onde assistir ao vivo e horário do jogo pela Sul-Americana ,Fluminense x once calda assistir vivo horario jogo sul americano,0
Copa Libertadores 2025: veja quais times têm mais títulos,,https://exame.com/esporte/copa-libertadores-2025-veja-quais-times-tem-mais-titulos/,exame,2025-05-31 19:11:09,resultado,Copa Libertadores 2025: veja quais times têm mais títulos ,copa libertador 2025 time titulo,0
Racing x Fortaleza: onde assistir ao vivo e horário do jogo pela Copa Libertadores,,https://exame.com/esporte/racing-x-fortaleza-onde-assistir-ao-vivo-e-horario-do-jogo-pela-copa-libertadores/,exame,2025-05-31 19:11:09,resultado,Racing x Fortaleza: onde assistir ao vivo e horário do jogo pela Copa Libertadores ,racing x fortaleza assistir vivo horario jogo copa libertador,0
Grêmio x Sportivo Luqueño: onde assistir ao vivo e horário do jogo pela Sul-Americana,,https://exame.com/esporte/gremio-x-sportivo-luqueno-onde-assistir-ao-vivo-e-horario-do-jogo-pela-sul-americana/,exame,2025-05-31 19:11:09,resultado,Grêmio x Sportivo Luqueño: onde assistir ao vivo e horário do jogo pela Sul-Americana ,gremio x sportivo luqueno assistir vivo horario jogo sul americano,0
