title,summary,url,source,collected_at,category,text,processed_text,label
PSG atropela a Inter com o brilho de Doué e enfim conquista a Champions,"Franceses têm atuação de gala e impõem a maior goleada da história das finais da Liga dos Campeões, faturando troféu inédito. Jovem francês faz dois gols e dá uma assistência",https://ge.globo.com/futebol/futebol-internacional/liga-dos-campeoes/jogo/31-05-2025/parissaintgermain-interdemilao.ghtml,ge,2025-05-31 19:11:09,resultado,"PSG atropela a Inter com o brilho de Doué e enfim conquista a Champions Franceses têm atuação de gala e impõem a maior goleada da história das finais da Liga dos Campeões, faturando troféu inédito. Jovem francês faz dois gols e dá uma assistência",psg atropelar inter brilho doue enfim conquistar champions francês atuacao gala impoem goleada historia final liga campeoe faturar trofeu ineditar jovem frances gol assistencia,0
Botafogo poupa Igor Jesus e Cuiabano contra Santos; veja time provável,Dupla sequer viaja para São Paulo por questões físicas,https://ge.globo.com/futebol/times/botafogo/noticia/2025/05/31/botafogo-poupa-igor-jesus-e-cuiabano-contra-santos-veja-time-provavel.ghtml,ge,2025-05-31 19:11:09,resultado,Botafogo poupa Igor Jesus e Cuiabano contra Santos; veja time provável Dupla sequer viaja para São Paulo por questões físicas,Botafogo poupar igor Jesus cuiabano santo time provavel dupla sequer viajar sao Paulo questoe fisico,0
"Marquinhos destaca superação do PSG para levar título da Champions: ""Sofremos muito""","Capitão ergueu a primeira taça do PSG na Champions League neste sábado, depois da vitória de 5 a 0 sobre a Inter de Milão",https://ge.globo.com/futebol/futebol-internacional/liga-dos-campeoes/noticia/2025/05/31/marquinhos-destaca-superacao-do-psg-apos-conquistar-a-champions-sofremos-muito.ghtml,ge,2025-05-31 19:11:09,resultado,"Marquinhos destaca superação do PSG para levar título da Champions: ""Sofremos muito"" Capitão ergueu a primeira taça do PSG na Champions League neste sábado, depois da vitória de 5 a 0 sobre a Inter de Milão",marquinho destacar superacao psg levar titulo champions sofrer capitao ergueu taca psg champions league sabado vitoria 5 0 inter Milao,0
"De saída do Cruzeiro, Alexandre Mattos encaminha acerto com Santos",Dirigente ocupava o posto de CEO do futebol do clube mineiro desde a compra do controle acionário da SAF cruzeirense pelo empresário Pedro Lourenço,https://ge.globo.com/mg/futebol/noticia/2025/05/31/alexandre-mattos-encaminha-saida-do-cruzeiro-e-abre-caminho-para-acerto-com-santos.ghtml,ge,2025-05-31 19:11:09,transferencia,"De saída do Cruzeiro, Alexandre Mattos encaminha acerto com Santos Dirigente ocupava o posto de CEO do futebol do clube mineiro desde a compra do controle acionário da SAF cruzeirense pelo empresário Pedro Lourenço",saida cruzeiro Alexandre Mattos encaminhar acerto santo dirigente ocupar posto ceo futebol clube mineiro compra controle acionario saf cruzeirense empresario Pedro Lourenco,1
"Torcida do PSG invade campo, mas é contida pela polícia; veja fotos","Torcedores do Paris Saint-Germain saíram da arquibancada da Allianz Arena e chegaram ao gramado, mas foram retirados pelos guardas. Jogadores foram para o vestiário por segurança",https://ge.globo.com/futebol/futebol-internacional/liga-dos-campeoes/noticia/2025/05/31/torcida-do-psg-invade-campo-mas-e-contida-pela-policia-veja-fotos.ghtml,ge,2025-05-31 19:11:09,transferencia,"Torcida do PSG invade campo, mas é contida pela polícia; veja fotos Torcedores do Paris Saint-Germain saíram da arquibancada da Allianz Arena e chegaram ao gramado, mas foram retirados pelos guardas. Jogadores foram para o vestiário por segurança",torcida psg invader campo contir policia foto torcedor Paris saint germain sair arquibancada Allianz arena chegar gramado retirar guarda jogador vestiario seguranca,1
Escalação do Fluminense: Samuel Xavier viaja e fica à disposição contra o Internacional,"Elenco terá folga após a partida antes da viagem para a Copa do Mundo de Clubes, no dia 6 de junho",https://ge.globo.com/futebol/times/fluminense/noticia/2025/05/31/escalacao-do-fluminense-samuel-xavier-viaja-e-fica-a-disposicao-contra-o-internacional.ghtml,ge,2025-05-31 19:11:09,resultado,"Escalação do Fluminense: Samuel Xavier viaja e fica à disposição contra o Internacional Elenco terá folga após a partida antes da viagem para a Copa do Mundo de Clubes, no dia 6 de junho",escalacao Fluminense Samuel xavier viajar ficar disposicao internacional elenco terar folga apo partida viagem copa mundo clube dia 6 junho,0
Atuações do Coritiba: Alex Silva brilha e comanda vitória sobre o Avaí; dê suas notas,"Coxa vence o time catarinense por 2 a 1 no Couto Pereira, pela 10ª rodada da Série B",https://ge.globo.com/pr/futebol/times/coritiba/noticia/2025/05/31/atuacoes-do-coritiba-alex-silva-brilha-e-comanda-vitoria-sobre-o-avai-de-suas-notas.ghtml,ge,2025-05-31 19:11:09,resultado,"Atuações do Coritiba: Alex Silva brilha e comanda vitória sobre o Avaí; dê suas notas Coxa vence o time catarinense por 2 a 1 no Couto Pereira, pela 10ª rodada da Série B",Atuacoes Coritiba Alex Silva brilhar comandar vitoria avai nota coxa vencer time catarinense 2 1 Couto Pereira 10a rodada serie b,0
"Mbappé e Neymar parabenizam PSG por título da Champions: ""Grande dia chegou""",Os dois jogadores atuaram por sete temporadas na equipe francesa e saíram sem conquistar a taça,https://ge.globo.com/futebol/futebol-internacional/noticia/2025/05/31/mbappe-parabeniza-psg-por-titulo-da-champions-grande-dia-chegou.ghtml,ge,2025-05-31 19:11:09,transferencia,"Mbappé e Neymar parabenizam PSG por título da Champions: ""Grande dia chegou"" Os dois jogadores atuaram por sete temporadas na equipe francesa e saíram sem conquistar a taça",Mbappe neymar parabenizar psg titulo champions dia chegar jogador atuar temporada equipe francês sair conquistar taca,1
Aliada de Augusto diz ter comando de Conselho no Corinthians e que impeachment está anulado,"Cartola tinha sido destituído da presidência do clube em votação no dia 26; Romeu Tuma Júnior, supostamente afastado, afirma que não reconhece ato",https://ge.globo.com/futebol/times/corinthians/noticia/2025/05/31/aliada-de-augusto-melo-afirma-ter-comando-de-conselho-e-anula-impeachment-no-corinthians.ghtml,ge,2025-05-31 19:11:09,transferencia,"Aliada de Augusto diz ter comando de Conselho no Corinthians e que impeachment está anulado Cartola tinha sido destituído da presidência do clube em votação no dia 26; Romeu Tuma Júnior, supostamente afastado, afirma que não reconhece ato",aliar augusto comando corinthians impeachment anular cartola ter ser destituer presidencia clube votacao dia 26 romeu tumar junior supostamente afastar afirmar nao reconhecer ato,1
Massacre do PSG sobre a Inter consagra apostas na juventude e jogo coletivo,,https://www.uol.com.br/esporte/colunas/julio-gomes/2025/05/31/massacre-do-psg-sobre-a-inter-consagra-apostas-na-juventude-e-jogo-coletivo.htm,uol,2025-05-31 19:11:09,resultado,Massacre do PSG sobre a Inter consagra apostas na juventude e jogo coletivo ,massacre psg inter consagrar aposta juventude jogo coletivo,0
PSG goleia Inter e bate recorde que era do maior rival dos italianos,"Pela primeira vez na história, a tão sonhada Champions League é do Paris Saint-Germain. O time francês atropelou a",https://www.uol.com.br/esporte/futebol/ultimas-noticias/2025/05/31/psg-goleia-inter-e-bate-recorde-que-era-do-maior-rival-dos-italianos.htm,uol,2025-05-31 19:11:09,resultado,"PSG goleia Inter e bate recorde que era do maior rival dos italianos Pela primeira vez na história, a tão sonhada Champions League é do Paris Saint-Germain. O time francês atropelou a",psg goleia inter bater recorde rival italiano historia tao sonhado champions League Paris saint germain time frances atropelar,0
"Ex-companheiros, Neymar e Mbappé parabenizam PSG por título da Champions","Pela primeira vez na história, a tão sonhada Champions League é do Paris Saint-Germain. O time francês atropelou a",https://www.uol.com.br/esporte/futebol/ultimas-noticias/gazeta-esportiva/2025/05/31/ex-companheiros-neymar-e-mbappe-parabenizam-psg-por-titulo-da-champions.htm,uol,2025-05-31 19:11:09,resultado,"Ex-companheiros, Neymar e Mbappé parabenizam PSG por título da Champions Pela primeira vez na história, a tão sonhada Champions League é do Paris Saint-Germain. O time francês atropelou a",ex companheiro neymar Mbappe parabenizar psg titulo champions historia tao sonhado champions League Paris saint germain time frances atropelar,0
"Portuguesa sai na frente, mas cede empate ao Nova Iguaçu pela Série D","Pela primeira vez na história, a tão sonhada Champions League é do Paris Saint-Germain. O time francês atropelou a",https://www.uol.com.br/esporte/futebol/ultimas-noticias/gazeta-esportiva/2025/05/31/portuguesa-sai-na-frente-mas-cede-empate-ao-nova-iguacu-pela-serie-d.htm,uol,2025-05-31 19:11:09,resultado,"Portuguesa sai na frente, mas cede empate ao Nova Iguaçu pela Série D Pela primeira vez na história, a tão sonhada Champions League é do Paris Saint-Germain. O time francês atropelou a",português sair frente ceder empate iguacu serie d historia tao sonhado champions League Paris saint germain time frances atropelar,0
Bom e barato? PSG campeão da Champions aposta em qualidade distribuída,"Pela primeira vez na história, a tão sonhada Champions League é do Paris Saint-Germain. O time francês atropelou a",https://www.uol.com.br/esporte/futebol/ultimas-noticias/2025/05/31/bom-e-barato-psg-campeao-da-champions-aposta-em-qualidade-distribuida.htm,uol,2025-05-31 19:11:09,resultado,"Bom e barato? PSG campeão da Champions aposta em qualidade distribuída Pela primeira vez na história, a tão sonhada Champions League é do Paris Saint-Germain. O time francês atropelou a",barato psg campeao champions aposta qualidade distribuir historia tao sonhado champions League Paris saint germain time frances atropelar,0
"Desfalque no São Paulo, Lucas veste camisa do PSG e celebra título da Liga dos Campeões","Pela primeira vez na história, a tão sonhada Champions League é do Paris Saint-Germain. O time francês atropelou a",https://www.uol.com.br/esporte/futebol/ultimas-noticias/gazeta-esportiva/2025/05/31/desfalque-no-sao-paulo-lucas-veste-camisa-do-psg-e-celebra-titulo-da-liga-dos-campeoes.htm,uol,2025-05-31 19:11:09,resultado,"Desfalque no São Paulo, Lucas veste camisa do PSG e celebra título da Liga dos Campeões Pela primeira vez na história, a tão sonhada Champions League é do Paris Saint-Germain. O time francês atropelou a",desfalque Sao Paulo lucas vestir camisa psg celebrar titulo liga campeoe historia tao sonhado champions League Paris saint germain time frances atropelar,0
"Ex-companheiros, Neymar e Mbappé parabenizam PSG por título da ChampionsPela primeira vez na história, a tão sonhada Champions League é do Paris Saint-Germain. O time francês atropelou a","Pela primeira vez na história, a tão sonhada Champions League é do Paris Saint-Germain. O time francês atropelou a",https://www.uol.com.br/esporte/futebol/ultimas-noticias/gazeta-esportiva/2025/05/31/ex-companheiros-neymar-e-mbappe-parabenizam-psg-por-titulo-da-champions.htm,uol,2025-05-31 19:11:09,resultado,"Ex-companheiros, Neymar e Mbappé parabenizam PSG por título da ChampionsPela primeira vez na história, a tão sonhada Champions League é do Paris Saint-Germain. O time francês atropelou a Pela primeira vez na história, a tão sonhada Champions League é do Paris Saint-Germain. O time francês atropelou a",ex companheiro neymar Mbappe parabenizar psg titulo championspela historia tao sonhado champions League Paris saint germain time frances atropelar historia tao sonhado champions League Paris saint germain time frances atropelar,0
"Portuguesa sai na frente, mas cede empate ao Nova Iguaçu pela Série DA Portuguesa empatou com o Nova Iguaçu por 1 a 1 neste sábado, pela sétima rodada da fase de grupos da Série D do...","A Portuguesa empatou com o Nova Iguaçu por 1 a 1 neste sábado, pela sétima rodada da fase de grupos da Série D do...",https://www.uol.com.br/esporte/futebol/ultimas-noticias/gazeta-esportiva/2025/05/31/portuguesa-sai-na-frente-mas-cede-empate-ao-nova-iguacu-pela-serie-d.htm,uol,2025-05-31 19:11:09,resultado,"Portuguesa sai na frente, mas cede empate ao Nova Iguaçu pela Série DA Portuguesa empatou com o Nova Iguaçu por 1 a 1 neste sábado, pela sétima rodada da fase de grupos da Série D do... A Portuguesa empatou com o Nova Iguaçu por 1 a 1 neste sábado, pela sétima rodada da fase de grupos da Série D do...",português sair frente ceder empate iguacu serie portuguesa empatar iguacu 1 1 sabado setimo rodada fase grupo serie d portuguesa empatar iguacu 1 1 sabado setimo rodada fase grupo serie d,0
"Desfalque no São Paulo, Lucas veste camisa do PSG e celebra título da Liga dos CampeõesFora da partida do São Paulo contra o Bahia, Lucas Moura vestiu a camisa do Paris Saint-Germain neste sábado e...","Fora da partida do São Paulo contra o Bahia, Lucas Moura vestiu a camisa do Paris Saint-Germain neste sábado e...",https://www.uol.com.br/esporte/futebol/ultimas-noticias/gazeta-esportiva/2025/05/31/desfalque-no-sao-paulo-lucas-veste-camisa-do-psg-e-celebra-titulo-da-liga-dos-campeoes.htm,uol,2025-05-31 19:11:09,resultado,"Desfalque no São Paulo, Lucas veste camisa do PSG e celebra título da Liga dos CampeõesFora da partida do São Paulo contra o Bahia, Lucas Moura vestiu a camisa do Paris Saint-Germain neste sábado e... Fora da partida do São Paulo contra o Bahia, Lucas Moura vestiu a camisa do Paris Saint-Germain neste sábado e...",desfalque Sao Paulo lucas vestir camisa psg celebrar titulo liga campeoesfora partida Sao Paulo Bahia lucas moura vestir camisa Paris saint germain sabado partida Sao Paulo Bahia lucas moura vestir camisa Paris saint germain sabado,0
Massacre do PSG sobre a Inter consagra apostas na juventude e jogo coletivoJulio Gomes,,https://www.uol.com.br/esporte/colunas/julio-gomes/2025/05/31/massacre-do-psg-sobre-a-inter-consagra-apostas-na-juventude-e-jogo-coletivo.htm,uol,2025-05-31 19:11:09,resultado,Massacre do PSG sobre a Inter consagra apostas na juventude e jogo coletivoJulio Gomes ,massacre psg inter consagrar aposta juventude jogo Coletivojulio gomes,0
"Luis Enrique reconquista a Champions League seis anos após morte da filha Xana: 'Onde quer que ela esteja, continuará festejando'","Técnico do PSG lembrou episódio marcante com a filha 10 anos atrás, quando foi campeão pelo Barcelona",https://www.espn.com.br/futebol/champions-league/artigo/_/id/15256536/luis-enrique-reconquista-champions-league-seis-anos-morte-filha-xana-onde-quer-esteja-continuara-festejando,espn,2025-05-31 19:11:09,transferencia,"Luis Enrique reconquista a Champions League seis anos após morte da filha Xana: 'Onde quer que ela esteja, continuará festejando' Técnico do PSG lembrou episódio marcante com a filha 10 anos atrás, quando foi campeão pelo Barcelona",Luis enrique reconquistar champions league ano apos morte filha xano estar continuar festejar tecnico psg lembrar episodio marcante filha 10 ano atras campeao Barcelona,1
Gol do Goiás e comemoração à la Memphis Depay! Anselmo Ramon empata contra o Atlético-GO,Assista à Série B no Disney+,https://www.espn.com.br/futebol/artigo/_/id/15256993,espn,2025-05-31 19:11:09,outras,Gol do Goiás e comemoração à la Memphis Depay! Anselmo Ramon empata contra o Atlético-GO Assista à Série B no Disney+,gol goias comemoracao la Memphis Depay Anselmo ramon empatar atletico go assistar serie b Disney,4
Mbappé manda recado após assistir ao PSG conquistar a Champions League primeira vez na história,"Jogador deixou o clube no ano passado, para jogar no Real Madrid",https://www.espn.com.br/futebol/champions-league/artigo/_/id/15256922/mbappe-manda-recado-assistir-psg-conquistar-champions-league-primeira-vez-historia,espn,2025-05-31 19:11:09,transferencia,"Mbappé manda recado após assistir ao PSG conquistar a Champions League primeira vez na história Jogador deixou o clube no ano passado, para jogar no Real Madrid",Mbappe mandar recado apos assistir psg conquistar champions league historia jogador deixar clube ano passado jogar real madrid,1
"Que pecado! Atlético-GO faz golaço em clássico contra o Goiás, mas arbitragem pega impedimento",Assista à Série B no Disney+,https://www.espn.com.br/futebol/artigo/_/id/15256917,espn,2025-05-31 19:11:09,outras,"Que pecado! Atlético-GO faz golaço em clássico contra o Goiás, mas arbitragem pega impedimento Assista à Série B no Disney+",pecado atletico go golaco classico goias arbitragem pegar impedimento assista serie b Disney,4
"'Neymar reencarnado' e condecorado até por presidente da França: quem é Doué, joia de 19 anos do PSG que 'destruiu' na final da Champions",Désiré Doué fez dois gols e ainda deu assistência em goleada por 5 a 0 do PSG sobre a Inter de Milão na final da Champions League,https://www.espn.com.br/player/132948/neymar,espn,2025-05-31 19:11:09,resultado,"'Neymar reencarnado' e condecorado até por presidente da França: quem é Doué, joia de 19 anos do PSG que 'destruiu' na final da Champions Désiré Doué fez dois gols e ainda deu assistência em goleada por 5 a 0 do PSG sobre a Inter de Milão na final da Champions League",neymar reencarnar condecorar ate presidente franca doue joia 19 ano psg destruir champions desire doue gol dar assistencia goleada 5 0 psg inter Milao champions League,0
"Jornal vai à loucura com título inédito do PSG na Champions: 'O que Neymar, Messi e Mbappé não conseguiram...'","Com elenco sem grandes estrelas, o PSG goleou a Inter de Milão e conquistou a Champions pela primeira vez",https://www.espn.com.br/futebol/club/_/id/160,espn,2025-05-31 19:11:09,outras,"Jornal vai à loucura com título inédito do PSG na Champions: 'O que Neymar, Messi e Mbappé não conseguiram...' Com elenco sem grandes estrelas, o PSG goleou a Inter de Milão e conquistou a Champions pela primeira vez",jornal loucura titulo ineditar psg champions neymar Messi Mbappe nao conseguir elenco estrela psg golear inter Milao conquistar champions,4
Gol do Atlético-GO! Alix abre o placar no clássico contra o Goiás,Assista à Série B no Disney+,https://www.espn.com.br/futebol/artigo/_/id/15256854,espn,2025-05-31 19:11:09,resultado,Gol do Atlético-GO! Alix abre o placar no clássico contra o Goiás Assista à Série B no Disney+,gol atletico go alix abrir placar classico goias assista serie b Disney,0
"Coritiba vence Avaí por 2 a 1 em jogo que teve gol no final, gol de falta e VAR; VEJA os melhores momentos","Partida aconteceu no Estádio Couto Pereira, em Curitiba e foi válida pela 10ª rodada da Série B",https://www.espn.com.br/futebol/artigo/_/id/15256844,espn,2025-05-31 19:11:09,resultado,"Coritiba vence Avaí por 2 a 1 em jogo que teve gol no final, gol de falta e VAR; VEJA os melhores momentos Partida aconteceu no Estádio Couto Pereira, em Curitiba e foi válida pela 10ª rodada da Série B",Coritiba vencer avai 2 1 jogo gol gol var bom momento partida acontecer estadio Couto Pereira curitiba valer 10a rodada serie b,0
CLÁSSICO GOIANO NA SÉRIE B! Atlético-GO encara o Goiás; VEJA,Assista à Série B no Disney+,https://www.espn.com.br/futebol/artigo/_/id/15256763,espn,2025-05-31 19:11:09,outras,CLÁSSICO GOIANO NA SÉRIE B! Atlético-GO encara o Goiás; VEJA Assista à Série B no Disney+,classico goiano serie b atletico go encarar goias assista serie b Disney,4
"Título da Champions garante Tríplice Coroa ao PSG, feito que nem Real Madrid conseguiu",PSG confirmou neste sábado o título da Liga dos Campeões da Europa ao bater a Inter de Milão,https://www.espn.com.br/futebol/club/_/id/160,espn,2025-05-31 19:11:09,outras,"Título da Champions garante Tríplice Coroa ao PSG, feito que nem Real Madrid conseguiu PSG confirmou neste sábado o título da Liga dos Campeões da Europa ao bater a Inter de Milão",titulo champions garantir triplice coroa psg fazer real madrid conseguir psg confirmar sabado titulo liga campeoe Europa bater inter Milao,4
PSG faz história na final da Champions e vence Inter de Milão por 5 a 0,,https://exame.com/esporte/psg-faz-historia-na-final-da-champions-e-vence-inter-de-milao-por-5-a-0/,exame,2025-05-31 19:11:09,outras,PSG faz história na final da Champions e vence Inter de Milão por 5 a 0 ,psg historia champions vencer inter Milao 5 0,4
"Campeão, PSG receberá R$ 42,2 milhões e jogará a Copa Intercontinental",,https://exame.com/esporte/campeao-psg-recebera-r-422-milhoes-e-jogara-a-copa-intercontinental/,exame,2025-05-31 19:11:09,outras,"Campeão, PSG receberá R$ 42,2 milhões e jogará a Copa Intercontinental ",Campeao psg receber r 42 2 milhoe jogar copa intercontinental,4
Vasco x RB Bragantino: onde assistir ao vivo e horário do jogo pelo Brasileirão,,https://exame.com/esporte/vasco-x-rb-bragantino-onde-assistir-ao-vivo-e-horario-do-jogo-pelo-brasileirao/,exame,2025-05-31 19:11:09,resultado,Vasco x RB Bragantino: onde assistir ao vivo e horário do jogo pelo Brasileirão ,vasco x rb bragantino assistir vivo horario jogo brasileirao,0
Inter Miami x Columbus Crew: onde assistir ao vivo e horário do jogo pela MLS,,https://exame.com/esporte/inter-miami-x-columbus-crew-onde-assistir-ao-vivo-e-horario-do-jogo-pela-mls/,exame,2025-05-31 19:11:09,resultado,Inter Miami x Columbus Crew: onde assistir ao vivo e horário do jogo pela MLS ,inter Miami x Columbus crew assistir vivo horario jogo ml,0
São Paulo x Bahia: onde assistir ao vivo e horário do jogo pelo Brasileirão,,https://exame.com/esporte/sao-paulo-x-bahia-onde-assistir-ao-vivo-e-horario-do-jogo-pelo-brasileirao/,exame,2025-05-31 19:11:09,resultado,São Paulo x Bahia: onde assistir ao vivo e horário do jogo pelo Brasileirão ,Sao Paulo x bahia assistir vivo horario jogo brasileirao,0
Paris Saint-Germain x Inter de Milão: onde assistir ao vivo e horário da final da Champions League,,https://exame.com/esporte/paris-saint-germain-x-inter-de-milao-onde-assistir-ao-vivo-e-horario-da-final-da-champions-league/,exame,2025-05-31 19:11:09,outras,Paris Saint-Germain x Inter de Milão: onde assistir ao vivo e horário da final da Champions League ,Paris saint germain x inter Milao assistir vivo horario champions League,4
"Jogos de hoje, sábado, 31 de maio, onde assistir ao vivo e horários",,https://exame.com/esporte/jogos-de-hoje-sabado-31-de-maio-onde-assistir-ao-vivo-e-horarios/,exame,2025-05-31 19:11:09,resultado,"Jogos de hoje, sábado, 31 de maio, onde assistir ao vivo e horários ",jogo hoje sabado 31 maio assistir vivo horario,0
Libertadores 2025: Flamengo tem 50% de chance de encarar times da Argentina nas oitavas,,https://exame.com/esporte/libertadores-2025-flamengo-tem-50-de-chance-de-encarar-times-da-argentina-nas-oitavas/,exame,2025-05-31 19:11:09,resultado,Libertadores 2025: Flamengo tem 50% de chance de encarar times da Argentina nas oitavas ,libertador 2025 flamengo 50 chance encarar time argentina oitava,0
Alexander-Arnold fecha contrato de seis anos com Real Madrid e deve estrear no Mundial de Clubes,,https://exame.com/esporte/alexander-arnold-fecha-contrato-de-seis-anos-com-real-madrid-e-deve-estrear-no-mundial-de-clubes/,exame,2025-05-31 19:11:09,transferencia,Alexander-Arnold fecha contrato de seis anos com Real Madrid e deve estrear no Mundial de Clubes ,Alexander arnold fechar contrato ano real madrid estrear mundial clube,1
Champions League: quanto custa assistir à final em cima da hora? Veja valores e como comprar,,https://exame.com/esporte/champions-league-quanto-custa-assistir-a-final-em-cima-da-hora-veja-valores-e-como-comprar/,exame,2025-05-31 19:11:09,transferencia,Champions League: quanto custa assistir à final em cima da hora? Veja valores e como comprar ,champions league assistir hora valor comprar,1
Pai de Neymar revela se Santos vai virar SAF: 'Ninguém vai rasgar dinheiro',,https://exame.com/esporte/pai-de-neymar-revela-se-santos-vai-virar-saf-ninguem-vai-rasgar-dinheiro/,exame,2025-05-31 19:11:09,outras,Pai de Neymar revela se Santos vai virar SAF: 'Ninguém vai rasgar dinheiro' ,pai neymar revelar santo virar saf ninguem rasgar dinheiro,4
"Jogos de hoje, sexta-feira, 30 de maio, onde assistir ao vivo e horários",,https://exame.com/esporte/jogos-de-hoje-sexta-feira-30-de-maio-onde-assistir-ao-vivo-e-horarios/,exame,2025-05-31 19:11:09,resultado,"Jogos de hoje, sexta-feira, 30 de maio, onde assistir ao vivo e horários ",jogo hoje feira 30 maio assistir vivo horario,0
Patrocínios e novos negócios impulsionam presença de PSG e Inter na final da Champions,,https://exame.com/esporte/patrocinios-e-novos-negocios-impulsionam-presenca-de-psg-e-inter-na-final-da-champions/,exame,2025-05-31 19:11:09,outras,Patrocínios e novos negócios impulsionam presença de PSG e Inter na final da Champions ,patrocinio negocio impulsionar presenca psg inter champions,4
Cristiano Ronaldo no Palmeiras? Time busca reforços; veja quem é o alvo de Abel Ferreira,,https://exame.com/esporte/cristiano-ronaldo-no-palmeiras-time-busca-reforcos-veja-quem-e-o-alvo-de-abel-ferreira/,exame,2025-05-31 19:11:09,resultado,Cristiano Ronaldo no Palmeiras? Time busca reforços; veja quem é o alvo de Abel Ferreira ,Cristiano ronaldo palmeira time buscar reforco alvo Abel Ferreira,0
Lamine Yamal renova com Barcelona até 2031 e se torna o atleta mais bem pago do clube,,https://exame.com/esporte/lamine-yamal-renova-com-barcelona-ate-2031-e-se-torna-o-atleta-mais-bem-pago-do-clube/,exame,2025-05-31 19:11:09,transferencia,Lamine Yamal renova com Barcelona até 2031 e se torna o atleta mais bem pago do clube ,lamine Yamal renovar Barcelona ate 2031 tornar atleta pagar clube,1
